{
  "schema": "dwp.hris.g7-sys-hrm-result-admission-receipt.v3",
  "receiptId": "HRIS-G7-SYS-HRM-RESULT-ADMISSION-SYS-HRM-R3-20261012-R3",
  "runId": "sys-hrm-r3-20261012-r3",
  "status": "PASS_RESULTS_ADMITTED_PENDING_CARRIER",
  "issuedAt": "2026-10-12T14:35:57Z",
  "issuedBy": "SYS_COMMON_INTEGRATION_CONTROL",
  "predecessor": {
    "r2PromotionReceipt": {
      "path": "docs/06-delivery/hris/2026-10-12-g7-sys-hrm-promotion-receipt.v2.json",
      "gitBlobSha1": "75d3dd7fb08520a026d051fb6121661171eefc28",
      "sha256": "d09e250da60b797404109dca5342db7cb6806144b51e3f5c92cd2ebc9925d275",
      "bytes": 7392,
      "carrierCommit": "2fc4faa5d8631dda6a3cbabefeef9ba606feca52",
      "carrierTree": "06807365ae5d289eda8ca82a6cc5071abc315037"
    },
    "activeTokenClosedSet": [
      "G7-START-SYS-BASE-TFR-SYS-007-R2",
      "G7-START-HRM-BASE-TFR-HRM-010-R2"
    ],
    "integrationMergeAuthorized": false
  },
  "testEvidence": {
    "path": "docs/06-delivery/hris/g7-delegation-successors/2026-10-12/sys-hrm-r3-result-acceptance/runs/sys-hrm-r3-20261012-r3/module-test-evidence.v3.json",
    "gitBlobSha1": "70ef9d9d84cc3090390d6954f043febf85b51874",
    "sha256": "ef59398e5c12b974b45a9cb993b5ca75ca61fd470c6e5b33cd87844eed1acf4b",
    "bytes": 5280,
    "carrierCommit": "bc135d9990e56c7e12e820f6700b40c3ebe3b083",
    "carrierTree": "4dc0951c0c23a75a2454a9b24731f74a326c878e",
    "evidenceId": "HRIS-G7-SYS-HRM-MODULE-TEST-EVIDENCE-SYS-HRM-R3-20261012-R3",
    "closedSet": [
      "SYS_BACKEND_TARGETED",
      "SYS_FRONTEND_TARGETED",
      "HRM_BACKEND_TARGETED",
      "HRM_FRONTEND_TARGETED"
    ]
  },
  "sharedVerificationPlan": {
    "path": "docs/06-delivery/hris/g7-delegation-successors/2026-10-12/sys-hrm-r3-result-acceptance/runs/sys-hrm-r3-20261012-r3/shared-verification-plan.v3.json",
    "gitBlobSha1": "ed1e55cec9de808829a01e35c78aecffd14129a6",
    "sha256": "a0c7ad4023effbdf3cacb17b772c8aea87ca3876da24ec86d8e1ea8aa7086096",
    "bytes": 3605,
    "carrierCommit": "bc135d9990e56c7e12e820f6700b40c3ebe3b083",
    "carrierTree": "4dc0951c0c23a75a2454a9b24731f74a326c878e",
    "planId": "HRIS-G7-SYS-HRM-SHARED-PLAN-SYS-HRM-R3-20261012-R3",
    "authorityStatus": "CONTROL_PROPOSAL_NOT_PREDECESSOR_AUTHORITY"
  },
  "sharedTestSource": {
    "path": "e2e/hris-sys-hrm-responsive-accessibility.spec.ts",
    "gitBlobSha1": "61f0df11bcee0da215f23073f8d53a4cb45a16ed",
    "sha256": "2094bc4dacbfaf9d6043ae557aaeeeab638f4ec9b9db4ab98822f2b59b98e85d",
    "bytes": 4001,
    "templateId": "G7-SYS-HRM-RESPONSIVE-ACCESSIBILITY-V2",
    "carrierCommit": "7f29f598d7a95e95c2690198e9ce5ae18a17a0fc",
    "carrierTree": "e667558257914f20ffeeaf536e53e781d188310b",
    "toolingCarrierCommit": "32eabff1faa17129cf5fdf011025320397ee3bb2",
    "toolingCarrierTree": "24876af211667714d3af9a8c6f8dd21a1c1a54e1",
    "branch": "codex/hris-g1-integration-frontend-20261006",
    "upstream": "origin/codex/hris-g1-integration-frontend-20261006",
    "carrierPushed": true,
    "exactControlPrerequisites": {
      "patch": {
        "path": "docs/06-delivery/hris/g7-delegation-successors/2026-10-12/sys-hrm-r3-result-acceptance/control-prerequisites.patch",
        "gitBlobSha1": "00636ad073f42455962c8f5ad94e66db55517e4c",
        "sha256": "3a2def1c8d6436719f8640e55c4f3695673a9f93fbd2bd137b7a7f639cb8c11e",
        "bytes": 21220
      },
      "modifiedPaths": [
        "apps/dwp/src/routes/product-route-contract-source.test.ts",
        "apps/dwp/src/routes/product-route-contract-source.ts",
        "apps/dwp/src/routes/product-route-contracts.generated.test.ts",
        "package.json",
        "scripts/internal-export-allowlist.json",
        "scripts/production-reachability-allowlist.json"
      ],
      "addedPaths": [
        "e2e/hris-sys-hrm-responsive-accessibility.spec.ts"
      ],
      "carrierChangedPathsClosedSet": true,
      "patchMatchesModifiedDiff": true
    },
    "sourceCarrierGate": {
      "status": "REQUIRED_BEFORE_INPUT_CARRIER",
      "requireCurrentHead": true,
      "requireClean": true,
      "requireExactUpstreamHead": true
    },
    "inputCarrierDirectChild": true
  },
  "toolchain": [
    {
      "path": "docs/06-delivery/hris/g7-delegation-successors/2026-10-12/sys-hrm-r3-result-acceptance/README.md",
      "gitBlobSha1": "57569ad0cdae5b4da95f837e70666a5c583fe492",
      "sha256": "3e4630962092cbced945b303dabe53ed0cec204b293e6278e79807777cd913e1",
      "bytes": 13869
    },
    {
      "path": "docs/06-delivery/hris/g7-delegation-successors/2026-10-12/sys-hrm-r3-result-acceptance/contracts/module-test-evidence-input.schema.v3.json",
      "gitBlobSha1": "f12e9e814344402fa6b68d17a6c7a672dcb2795d",
      "sha256": "59f83762efe2493532664faffe1aaabb573c504961d4e37812ba070e3854b298",
      "bytes": 2993
    },
    {
      "path": "docs/06-delivery/hris/g7-delegation-successors/2026-10-12/sys-hrm-r3-result-acceptance/contracts/shared-verification-plan.schema.v3.json",
      "gitBlobSha1": "93c3c252efb2eb52061eea63bcc98f5ad75de57a",
      "sha256": "bc02f659f8e8d931b8f4dcb7282494cf31af716b5e4bbb06b9d17c1a0923ffa8",
      "bytes": 3748
    },
    {
      "path": "docs/06-delivery/hris/g7-delegation-successors/2026-10-12/sys-hrm-r3-result-acceptance/contracts/shared-verification-evidence-input.schema.v3.json",
      "gitBlobSha1": "b9a365e7304b7ec8f2299d15dc1e002c37742d44",
      "sha256": "efc1d1e7133f1bf8873ad3f234eb6d1421855c6f1a2713d04761262f4c6c63f0",
      "bytes": 11331
    },
    {
      "path": "docs/06-delivery/hris/g7-delegation-successors/2026-10-12/sys-hrm-r3-result-acceptance/contracts/result-admission-receipt.schema.v3.json",
      "gitBlobSha1": "fc5c14fc9fe979e8495d1653f17908ba9732a779",
      "sha256": "62cf5ac3a8f00bddce17806eb79adad9b7f0fe6940e5052929f4e1ae21fb266f",
      "bytes": 12629
    },
    {
      "path": "docs/06-delivery/hris/g7-delegation-successors/2026-10-12/sys-hrm-r3-result-acceptance/contracts/integration-authorization-receipt.schema.v3.json",
      "gitBlobSha1": "e4374f7087ab7261966cca9fd3729e2cf7427666",
      "sha256": "a1e8f0952c2430dac9eb85802211a42b1720fbcd3b897cd6373abd10527f6456",
      "bytes": 9237
    },
    {
      "path": "docs/06-delivery/hris/g7-delegation-successors/2026-10-12/sys-hrm-r3-result-acceptance/contracts/closure-receipt.schema.v3.json",
      "gitBlobSha1": "bd6dc9e9aff71ea39cb6255051531dd847a7f909",
      "sha256": "f5b8be3b1ac9ed9b02a2ced6856d2f58fb9a673a9bd405c52e43a9f983d703c3",
      "bytes": 7609
    },
    {
      "path": "docs/06-delivery/hris/g7-delegation-successors/2026-10-12/sys-hrm-r3-result-acceptance/control-prerequisites.patch",
      "gitBlobSha1": "00636ad073f42455962c8f5ad94e66db55517e4c",
      "sha256": "3a2def1c8d6436719f8640e55c4f3695673a9f93fbd2bd137b7a7f639cb8c11e",
      "bytes": 21220
    },
    {
      "path": "docs/06-delivery/hris/g7-delegation-successors/2026-10-12/sys-hrm-r3-result-acceptance/materialize_g7_sys_hrm_result_acceptance.py",
      "gitBlobSha1": "9bb136e163bacc88f830dc0560ae3b975671fe71",
      "sha256": "44387a29941b953068443c5ed850de60dfcfdf877c8ca18ba61a708e72c7429a",
      "bytes": 136096
    },
    {
      "path": "docs/06-delivery/hris/g7-delegation-successors/2026-10-12/sys-hrm-r3-result-acceptance/validate_g7_sys_hrm_result_acceptance.py",
      "gitBlobSha1": "12624b90e08cc27c884e42fe67eb456b0dda627b",
      "sha256": "ba0f6983860a5ca4c03958b403797b2c5c37c9b55cdcd37f312788e2b38c7ebd",
      "bytes": 115541
    },
    {
      "path": "docs/06-delivery/hris/g7-delegation-successors/2026-10-12/sys-hrm-r3-result-acceptance/test_g7_sys_hrm_result_acceptance.py",
      "gitBlobSha1": "721c98b8192af88bf54984a118d936bda7e9c5b7",
      "sha256": "2032779f0c186b710f1020553d63d4bfc46a3f5cd4c258eee78d30ebd4866140",
      "bytes": 98131
    }
  ],
  "moduleResults": [
    {
      "module": "SYS",
      "sliceId": "BASE-TFR-SYS-007",
      "tokenId": "G7-START-SYS-BASE-TFR-SYS-007-R2",
      "tokenExpiresAt": "2026-10-19T09:32:01Z",
      "pathPolicySha256": "c8b56ea099ba546c434fc8d3f6bf2fe8a84f5bddc37d76dd2b372ac3c3fdda74",
      "worktrees": [
        {
          "repo": "frontend",
          "absolutePath": "/Users/a10697/Work/DWP/.codex-worktrees/hris/g7-20261012-r2/sys-007/frontend",
          "branch": "codex/hris-g7-sys-007-frontend-20261012-r2",
          "upstream": "origin/codex/hris-g7-sys-007-frontend-20261012-r2",
          "basePin": {
            "commit": "407dcdfdc4af642838a62a4ac64e06baf50d546b",
            "tree": "50f417758e5df7a289a0e2ac4e4761e48ae7a4e4"
          },
          "resultPin": {
            "commit": "bb551d5607a4bff3e2b51be9e1af5483470b1647",
            "tree": "8a163975fcc900141ef9e3c1aafeae7403355a87"
          },
          "clean": true,
          "upstreamMatched": true,
          "changedFiles": [
            {
              "path": "apps/dwp/src/features/hris/administration/reference-configuration/api/reference-configuration-api.ts",
              "change": "ADD",
              "before": null,
              "after": {
                "mode": "100644",
                "gitBlobSha1": "0eb8c9b706afc3e1c83cd42a83116e11b78a9fbf",
                "bytes": 14190,
                "sha256": "df597093d9303a1decf97f7736ee8cd37efebc44128399e5b2ac29e36997be73"
              }
            },
            {
              "path": "apps/dwp/src/features/hris/administration/reference-configuration/components/reference-configuration-studio.tsx",
              "change": "ADD",
              "before": null,
              "after": {
                "mode": "100644",
                "gitBlobSha1": "b2f4fbcfc31d6135902bca419281cd0928860426",
                "bytes": 16388,
                "sha256": "eb57262f7b32281c79dd0d8b28ecc73e9cf991803257fa54e877e7ada6d75160"
              }
            },
            {
              "path": "apps/dwp/src/features/hris/administration/reference-configuration/hooks/use-reference-configuration-workspace.ts",
              "change": "ADD",